<?xml encoding="UTF-8"?>
<!ELEMENT PACKAGE ((PROCEDURE)*,(MESSAGE)*,FILEREFERENCETABLE)>
<!ELEMENT PROCEDURE (BLOCKFILE,BLOCKLINE,(PROCEDURE)*,(BEGINBLOCK)*)>
<!ELEMENT BEGINBLOCK (BLOCKFILE,BLOCKLINE,(PROCEDURE)*,(BEGINBLOCK)*)>
<!ELEMENT MESSAGE (MSGNUMBER,MSGLINE?,MSGFILE?,MSGTEXT)>
<!ELEMENT FILE (FILENUMBER,INCLUDEDFROMFILE?,INCLUDEDONLINE?,FILENAME)>
<!ELEMENT FILEREFERENCETABLE (FILECOUNT,FILE+)>
<!ELEMENT BLOCKFILE (#PCDATA)>
<!ELEMENT BLOCKLINE (#PCDATA)>
<!ELEMENT MSGNUMBER (#PCDATA)>
<!ELEMENT MSGLINE (#PCDATA)>
<!ELEMENT MSGFILE (#PCDATA)>
<!ELEMENT MSGTEXT (#PCDATA)>
<!ELEMENT FILECOUNT (#PCDATA)>
<!ELEMENT FILENUMBER (#PCDATA)>
<!ELEMENT FILENAME (#PCDATA)>
<!ELEMENT INCLUDEDFROMFILE (#PCDATA)>
<!ELEMENT INCLUDEDONLINE (#PCDATA)>
