<?xml version="1.0" encoding="UTF-8"?>
<!DOCTYPE plicomp SYSTEM "plicomp.dtd">
<PACKAGE>
<FILEREFERENCETABLE>
<FILECOUNT>2</FILECOUNT>
<FILE>
<FILENUMBER>0</FILENUMBER>
<FILENAME>PLITEST5</FILENAME>
</FILE>
<FILE>
<FILENUMBER>1</FILENUMBER>
<FILENAME>FOO</FILENAME>
<INCLUDEDFROMFILE>1</INCLUDEDFROMFILE>
<INCLUDEDONLINE>1</INCLUDEDONLINE>
</FILE>
</FILEREFERENCETABLE>
<PROCEDURE>
HALLO
<BLOCKFILE>
1
</BLOCKFILE>
<BLOCKLINE>
1
</BLOCKLINE>
</PROCEDURE>
<MESSAGE>
<MSGNUMBER>IBM1316I E</MSGNUMBER>
<MSGLINE>1</MSGLINE>
<MSGFILE>1</MSGFILE>
<MSGTEXT>BAR</MSGTEXT>
</MESSAGE>
<MESSAGE>
<MSGNUMBER>IBM00000 E</MSGNUMBER>
<MSGLINE>1</MSGLINE>
<MSGFILE>1</MSGFILE>
<MSGTEXT>FOO</MSGTEXT>
</MESSAGE>
</PACKAGE>
