<?xml version="1.0" encoding="UTF-8"?>
<!DOCTYPE plicomp SYSTEM "plicomp.dtd">
<PACKAGE>
<FILEREFERENCETABLE>
<FILECOUNT>
1
</FILECOUNT>
<FILE>
<FILENUMBER>0</FILENUMBER>
<FILENAME>SYS1.RULES.PLI(APLITEST)</FILENAME>
</FILE>
</FILEREFERENCETABLE>
<PROCEDURE>
HALLO
<BLOCKFILE>
1
</BLOCKFILE>
<BLOCKLINE>
1
</BLOCKLINE>
</PROCEDURE>
<MESSAGE>
<MSGNUMBER>IBM1316I E</MSGNUMBER>
<MSGLINE>3</MSGLINE>
<MSGFILE>0</MSGFILE>
<MSGTEXT>END label is not a label on any open group.</MSGTEXT>
</MESSAGE>
</PACKAGE>
