<?xml version='1.0' encoding='IBM-01140'?>
<!DOCTYPE plicomp SYSTEM 'plicomp.dtd'>
<PACKAGE>
<FILEREFERENCETABLE>
<FILECOUNT>1</FILECOUNT>
<FILE>
<FILENUMBER>0</FILENUMBER>
<FILENAME>Z39486.ZDEV.PLI(HELLOW)</FILENAME>
</FILE>
</FILEREFERENCETABLE>
<PROCEDURE>HELLOW
<BLOCKFILE>1</BLOCKFILE>
<BLOCKLINE>1</BLOCKLINE>
</PROCEDURE>
<MESSAGE>
<MSGNUMBER>IBM3317I W</MSGNUMBER>
<MSGLINE>7</MSGLINE>
<MSGFILE>0</MSGFILE>
<MSGTEXT>DSNH030I DSNHANAL LINE 7 COL 1  STATEMENT CONTAINS WRONG NUMBER OF &quot;INTO&quot; VARIABLES</MSGTEXT>
</MESSAGE>
<MESSAGE>
<MSGNUMBER>IBM3000I I</MSGNUMBER>
<MSGTEXT>DSNH4790I DSNHPSRV  DSNHDECP HAS CCSID 500 IN EFFECT</MSGTEXT>
</MESSAGE>
<MESSAGE>
<MSGNUMBER>IBM1043I I</MSGNUMBER>
<MSGLINE>12</MSGLINE>
<MSGFILE>0</MSGFILE>
<MSGTEXT>SYSPRINT is contextually declared as FILE.</MSGTEXT>
</MESSAGE>
</PACKAGE>
