<?xml version="1.0" encoding="UTF-8"?>
<!DOCTYPE plicomp SYSTEM "plicomp.dtd">
<PACKAGE>
<FILEREFERENCETABLE>
<FILECOUNT>1</FILECOUNT>
<FILE>
<FILENUMBER>0</FILENUMBER>
<FILENAME>PLITEST8</FILENAME>
</FILE>
</FILEREFERENCETABLE>
<PROCEDURE>
HALLO
<BLOCKFILE>
1
</BLOCKFILE>
<BLOCKLINE>
1
</BLOCKLINE>
</PROCEDURE>
<MESSAGE>
<MSGNUMBER>IBM1213I W</MSGNUMBER>
<MSGLINE>1000</MSGLINE>
<MSGFILE>0</MSGFILE>
<MSGTEXT>The procedure SEQERR is not referenced.</MSGTEXT>
</MESSAGE>
<MESSAGE>
<MSGNUMBER>IBM2418I E</MSGNUMBER>
<MSGLINE>1</MSGLINE>
<MSGFILE>0</MSGFILE>
<MSGTEXT>Variable PLERROR is unreferenced.</MSGTEXT>
</MESSAGE>
<MESSAGE>
<MSGNUMBER>IBM1195I W</MSGNUMBER>
<MSGLINE>1</MSGLINE>
<MSGFILE>0</MSGFILE>
<MSGTEXT>Argument to MAIN procedure is not CHARACTER VARYING.</MSGTEXT>
</MESSAGE>
</PACKAGE>
